{
  "height_in": 67,
  "weight_lb": 150,
  "cargo_lb": 0,
  "stance": "goofy",
  "board_experience": "advanced",
  "snowboard_experience": "advanced",
  "speed_comfort": 45,
  "electric_propulsion": "no",
  "typical_miles": 5,
  "longest_miles": 8,
  "cruise_mph": 10,
  "speed_ceiling_mph": 15,
  "recharge_hours": null,
  "stop_start": false,
  "terrain_pavement": 20,
  "terrain_packed_dirt": 45,
  "terrain_loose_gravel": 20,
  "terrain_roots_rocks": 10,
  "terrain_grass_brush": 5,
  "hill_profile": "rolling",
  "wet_exposure": "never",
  "jumps_drops": "small",
  "snowboard_feel": 95,
  "stability_preference": 55,
  "compliance_preference": 75,
  "maneuverability_preference": 80,
  "budget_usd": 900,
  "hard_budget_usd": 1300,
  "max_board_weight_lb": 25,
  "portability_need": "high",
  "maintenance_tolerance": "moderate",
  "noise_priority": true,
  "fabrication_access": "printer",
  "electronics_skill": "basic",
  "priority_range": 15,
  "priority_carve": 100,
  "priority_stability": 55,
  "priority_durability": 85,
  "priority_portability": 80,
  "priority_cost": 70,
  "priority_low_maintenance": 70
}
