{
  "height_in": 70,
  "weight_lb": 175,
  "cargo_lb": 8,
  "stance": "regular",
  "board_experience": "intermediate",
  "snowboard_experience": "advanced",
  "speed_comfort": 55,
  "electric_propulsion": "yes",
  "typical_miles": 12,
  "longest_miles": 22,
  "cruise_mph": 14,
  "speed_ceiling_mph": 20,
  "recharge_hours": 5,
  "stop_start": false,
  "terrain_pavement": 15,
  "terrain_packed_dirt": 35,
  "terrain_loose_gravel": 25,
  "terrain_roots_rocks": 20,
  "terrain_grass_brush": 5,
  "hill_profile": "rolling",
  "wet_exposure": "occasional",
  "jumps_drops": "small",
  "snowboard_feel": 90,
  "stability_preference": 70,
  "compliance_preference": 80,
  "maneuverability_preference": 70,
  "budget_usd": 1600,
  "hard_budget_usd": 2200,
  "max_board_weight_lb": 34,
  "portability_need": "moderate",
  "maintenance_tolerance": "moderate",
  "noise_priority": false,
  "fabrication_access": "basic",
  "electronics_skill": "basic",
  "priority_range": 70,
  "priority_carve": 95,
  "priority_stability": 70,
  "priority_durability": 90,
  "priority_portability": 45,
  "priority_cost": 55,
  "priority_low_maintenance": 55
}
